{
  "schema_version": "1",
  "generated_at": "2026-08-23T09:22:46Z",
  "report_date": "20260823",
  "git": {
    "repo": "murakotaro4/MS_data",
    "branch": "main",
    "head_sha": "f69119e514ad24487c32c02de0297f642398995f"
  },
  "github": {
    "run_id": "32630813878",
    "run_attempt": "1",
    "workflow": "data update",
    "event_name": "schedule"
  },
  "params": {
    "ttl": "1h",
    "rate": "2.0",
    "limit": "0"
  },
  "inputs": {
    "index": {
      "path": "cache/index.json",
      "sha256": "732b6565dc0408730a9ad91ab3c04d4721e00aea693d5cf7943a3f46f2465fd1",
      "size_bytes": 145143,
      "record_count": 590
    },
    "details_jsonl": {
      "path": "cache/details.jsonl",
      "sha256": "4b0ee2fbc229c3c8a822eba4b2ed587bca0958bedac0e2821d0d36038c766440",
      "size_bytes": 15341,
      "record_count": 13
    },
    "details_json": {
      "path": "cache/details.json",
      "sha256": "787cbddfdea24d17c2b855cb00c484a5b3b36511afdefa2daf11dcac54c9748e",
      "size_bytes": 20040,
      "record_count": 13
    },
    "html_cache": {
      "path": "cache/html",
      "sha256": "fcb37401ae53ae78f1c99cee0b3afd83ad4c9e7edd96721be1f0774fea33fb1d",
      "file_count": 8,
      "size_bytes": 1801334
    }
  },
  "outputs": {
    "msdata_json": {
      "path": "msData.json",
      "sha256": "a8907cff6fb7112f73dcbcd3123210264bac0ce5cea6c206593d6d6f5d5ddcaa",
      "size_bytes": 2628050,
      "record_count": 1701
    },
    "diff_report": {
      "path": "reports/2026/08/diff_msdata_20260823.md",
      "sha256": "46276a8dded8d00418a01ffba4b91715482a1f72245636b8c37340fb0ad2f31a",
      "size_bytes": 3552
    }
  },
  "artifact": {
    "name": "raw-snapshot-20260823-run-32630813878",
    "retention_days": 90
  },
  "release": {
    "tag": "raw-snapshot-20260823-run-32630813878",
    "asset_name": "raw_snapshot_20260823_run32630813878.tar.xz",
    "url": "https://github.com/murakotaro4/MS_data/releases/tag/raw-snapshot-20260823-run-32630813878"
  }
}
