{
  "schema_version": "1",
  "generated_at": "2026-05-02T09:27:10Z",
  "report_date": "20260502",
  "git": {
    "repo": "murakotaro4/MS_data",
    "branch": "main",
    "head_sha": "2ac99e25a6c3d24ffc46b971d9a1ed34d94ea5f3"
  },
  "github": {
    "run_id": "25248864807",
    "run_attempt": "1",
    "workflow": "data update",
    "event_name": "schedule"
  },
  "params": {
    "ttl": "1h",
    "rate": "2.0",
    "limit": "0"
  },
  "inputs": {
    "index": {
      "path": "cache/index.json",
      "sha256": "8d60ed82557151e7ecad8e2759dd232d0836cf7720b36e33d2cac81f1ab2415d",
      "size_bytes": 140572,
      "record_count": 571
    },
    "details_jsonl": {
      "path": "cache/details.jsonl",
      "sha256": "ad3f7d33032d0a17a3bf4e38470153ac415fd860105a2917048ba700a7a5e114",
      "size_bytes": 39413,
      "record_count": 33
    },
    "details_json": {
      "path": "cache/details.json",
      "sha256": "aa9d5ded9aa90bf34e204b7b0502900a9600d49836c0b0eb7a84530815775b54",
      "size_bytes": 51420,
      "record_count": 33
    },
    "html_cache": {
      "path": "cache/html",
      "sha256": "673946a74ce1075651fc97c443cfce1fd0e573ad50ebc41021232247c6aae242",
      "file_count": 28,
      "size_bytes": 4844744
    }
  },
  "outputs": {
    "msdata_json": {
      "path": "msData.json",
      "sha256": "ee909a481f9ac5e2f915a23f21a66cf4c0497f5eb44d55740844eea7a7b67b72",
      "size_bytes": 2531793,
      "record_count": 1640
    },
    "diff_report": {
      "path": "reports/diff_msdata_20260502.md",
      "sha256": "974ef01bf63c621f8d71ae30835d12b66199b4c0fe2003da433be17b17365876",
      "size_bytes": 2462
    }
  },
  "artifact": {
    "name": "raw-snapshot-20260502-run-25248864807",
    "retention_days": 90
  },
  "release": {
    "tag": "raw-snapshot-20260502-run-25248864807",
    "asset_name": "raw_snapshot_20260502_run25248864807.tar.xz",
    "url": "https://github.com/murakotaro4/MS_data/releases/tag/raw-snapshot-20260502-run-25248864807"
  }
}
