{
  "schema_version": "1",
  "generated_at": "2026-08-22T09:23:12Z",
  "report_date": "20260822",
  "git": {
    "repo": "murakotaro4/MS_data",
    "branch": "main",
    "head_sha": "20611fb1c0b48dd1664f9e32d45f53365de37ac4"
  },
  "github": {
    "run_id": "32564769144",
    "run_attempt": "1",
    "workflow": "data update",
    "event_name": "schedule"
  },
  "params": {
    "ttl": "1h",
    "rate": "2.0",
    "limit": "0"
  },
  "inputs": {
    "index": {
      "path": "cache/index.json",
      "sha256": "3474ec9f5448a8478f27ec6c019fcd1613b2a5d0c4d8247fe057a0792be0e768",
      "size_bytes": 145097,
      "record_count": 590
    },
    "details_jsonl": {
      "path": "cache/details.jsonl",
      "sha256": "f74219be024a4c0c035e1da359b1f2983d0e7395660a7f667016236a7eeca729",
      "size_bytes": 44943,
      "record_count": 39
    },
    "details_json": {
      "path": "cache/details.json",
      "sha256": "c9863bad230ec19f1f4786e3d96a7b721322ff27282d9fad0a342d1a26b4a495",
      "size_bytes": 58996,
      "record_count": 39
    },
    "html_cache": {
      "path": "cache/html",
      "sha256": "2cd80293065c1e5b53a2e0c48459a39a31fcbe989de6982b1bdc93012fc8ffa1",
      "file_count": 36,
      "size_bytes": 6223799
    }
  },
  "outputs": {
    "msdata_json": {
      "path": "msData.json",
      "sha256": "08218445af5ff2a3276ead22de4a544cd8538ddd2a27b9d0bf1ddef960ad7436",
      "size_bytes": 2628061,
      "record_count": 1701
    },
    "diff_report": {
      "path": "reports/2026/08/diff_msdata_20260822.md",
      "sha256": "2292d6c0586171cd673b41758f2b0f60e29eda1301dc5ae51392ba7e3613c682",
      "size_bytes": 1346
    }
  },
  "artifact": {
    "name": "raw-snapshot-20260822-run-32564769144",
    "retention_days": 90
  },
  "release": {
    "tag": "raw-snapshot-20260822-run-32564769144",
    "asset_name": "raw_snapshot_20260822_run32564769144.tar.xz",
    "url": "https://github.com/murakotaro4/MS_data/releases/tag/raw-snapshot-20260822-run-32564769144"
  }
}
