{
  "schema_version": "1",
  "generated_at": "2026-08-14T09:57:04Z",
  "report_date": "20260814",
  "git": {
    "repo": "murakotaro4/MS_data",
    "branch": "main",
    "head_sha": "22906ea69cc6498ac63b322cb918f4e067d3eb31"
  },
  "github": {
    "run_id": "31790157638",
    "run_attempt": "1",
    "workflow": "data update",
    "event_name": "schedule"
  },
  "params": {
    "ttl": "1h",
    "rate": "2.0",
    "limit": "0"
  },
  "inputs": {
    "index": {
      "path": "cache/index.json",
      "sha256": "d3c937f0abd6775681326d21f7b4e91eb9f5d0640ce8ff6069cf0b93440feb7d",
      "size_bytes": 144809,
      "record_count": 589
    },
    "details_jsonl": {
      "path": "cache/details.jsonl",
      "sha256": "ce31d8bd45f5b2ab7c59d0445f11dbc0b15050b11ce7269d9b5ee7b855157079",
      "size_bytes": 83085,
      "record_count": 71
    },
    "details_json": {
      "path": "cache/details.json",
      "sha256": "6cbddf61d85c3f1e58dd39f494fceaf93628665186ddedac3d1b25dfe5c6409b",
      "size_bytes": 108778,
      "record_count": 71
    },
    "html_cache": {
      "path": "cache/html",
      "sha256": "a23a3a2c328446833fb8da79a3c518794ba75c61c9cce7b96774f4a8988e2b72",
      "file_count": 46,
      "size_bytes": 7737588
    }
  },
  "outputs": {
    "msdata_json": {
      "path": "msData.json",
      "sha256": "42ee3c762fea1702afae92938aede73c769f516e76709d627998633a81b27ba6",
      "size_bytes": 2608566,
      "record_count": 1688
    },
    "diff_report": {
      "path": "reports/2026/08/diff_msdata_20260814.md",
      "sha256": "961a9be3c0882bc495d51b4fbce7b1b6a5e366718cbc7e9333ba712e271e5234",
      "size_bytes": 2840
    }
  },
  "artifact": {
    "name": "raw-snapshot-20260814-run-31790157638",
    "retention_days": 90
  },
  "release": {
    "tag": "raw-snapshot-20260814-run-31790157638",
    "asset_name": "raw_snapshot_20260814_run31790157638.tar.xz",
    "url": "https://github.com/murakotaro4/MS_data/releases/tag/raw-snapshot-20260814-run-31790157638"
  }
}
