{
  "schema_version": "1",
  "generated_at": "2026-06-07T10:13:12Z",
  "report_date": "20260607",
  "git": {
    "repo": "murakotaro4/MS_data",
    "branch": "main",
    "head_sha": "df7408af32454336e5e24bfce4689c811001c446"
  },
  "github": {
    "run_id": "27089344053",
    "run_attempt": "1",
    "workflow": "data update",
    "event_name": "schedule"
  },
  "params": {
    "ttl": "1h",
    "rate": "2.0",
    "limit": "0"
  },
  "inputs": {
    "index": {
      "path": "cache/index.json",
      "sha256": "9b63471b845ded4024233413d7cbd6e3d791675e0c703e54b8f9c95eb9c3bb9d",
      "size_bytes": 141511,
      "record_count": 575
    },
    "details_jsonl": {
      "path": "cache/details.jsonl",
      "sha256": "13b401c9736677119f0239daedb97f068cb7c154e5b6780265a5434c19f94b38",
      "size_bytes": 1944430,
      "record_count": 1646
    },
    "details_json": {
      "path": "cache/details.json",
      "sha256": "06b4611ac262de0446b566f96fd3f04619e57ab79a4f09b8e7f6e84a0ecb3417",
      "size_bytes": 2542098,
      "record_count": 1646
    },
    "html_cache": {
      "path": "cache/html",
      "sha256": "72a527033942ad57d7665b22409e8282c72cf29b579cb65f3e66710ecd1b3b0c",
      "file_count": 1152,
      "size_bytes": 181771916
    }
  },
  "outputs": {
    "msdata_json": {
      "path": "msData.json",
      "sha256": "dc6ec34f096b758115bea04a1c26abe5ad10bb7b520b1190aac8fc8c289ec7b1",
      "size_bytes": 2543291,
      "record_count": 1647
    },
    "diff_report": {
      "path": "reports/diff_msdata_20260607.md",
      "sha256": "3f4e64507b18a3413061b50eb5506062152b1ee02fcf7d746ac13ffc0a5c391a",
      "size_bytes": 3000
    }
  },
  "artifact": {
    "name": "raw-snapshot-20260607-run-27089344053",
    "retention_days": 90
  },
  "release": {
    "tag": "raw-snapshot-20260607-run-27089344053",
    "asset_name": "raw_snapshot_20260607_run27089344053.tar.xz",
    "url": "https://github.com/murakotaro4/MS_data/releases/tag/raw-snapshot-20260607-run-27089344053"
  }
}
