{
  "schema_version": "1",
  "generated_at": "2026-09-01T13:54:01Z",
  "report_date": "20260901",
  "git": {
    "repo": "murakotaro4/MS_data",
    "branch": "main",
    "head_sha": "e4a444dedeb6b82eb70fc8f093cd1d93f54b7a96"
  },
  "github": {
    "run_id": "33516140452",
    "run_attempt": "1",
    "workflow": "data update",
    "event_name": "schedule"
  },
  "params": {
    "ttl": "1h",
    "rate": "2.0",
    "limit": "0"
  },
  "inputs": {
    "index": {
      "path": "cache/index.json",
      "sha256": "adfb9eb83f115b7eafc4dfe1d30004fadc41f363149cce99e5fb1b0cdfcb555b",
      "size_bytes": 145370,
      "record_count": 591
    },
    "details_jsonl": {
      "path": "cache/details.jsonl",
      "sha256": "28c44e5f0f86ab728567463be6a6e9b4cb6956a60adbbfef79a451c25d6c6d01",
      "size_bytes": 26324,
      "record_count": 22
    },
    "details_json": {
      "path": "cache/details.json",
      "sha256": "7cd5df65a0836df347988cd955ae00eaf9c0a78b884aba26187ad059aed10495",
      "size_bytes": 34348,
      "record_count": 22
    },
    "html_cache": {
      "path": "cache/html",
      "sha256": "c4d38f9e8cd0ae027a9bcf520b185218609a31a2198b46becedfce078086a75e",
      "file_count": 20,
      "size_bytes": 3765495
    }
  },
  "outputs": {
    "msdata_json": {
      "path": "msData.json",
      "sha256": "33c05ff2df58aaea20fa11bc974d7f8ea9a5c27346ff74b633258f4605e7c136",
      "size_bytes": 2636316,
      "record_count": 1706
    },
    "diff_report": {
      "path": "reports/2026/09/diff_msdata_20260901.md",
      "sha256": "90eedbb7482c006e6c4dcfa6520f7da52ae88ff582ae11c118b7d797e1550798",
      "size_bytes": 1338
    }
  },
  "artifact": {
    "name": "raw-snapshot-20260901-run-33516140452",
    "retention_days": 90
  },
  "release": {
    "tag": "raw-snapshot-20260901-run-33516140452",
    "asset_name": "raw_snapshot_20260901_run33516140452.tar.xz",
    "url": "https://github.com/murakotaro4/MS_data/releases/tag/raw-snapshot-20260901-run-33516140452"
  }
}
