{
  "schema_version": "1",
  "generated_at": "2026-04-02T09:23:30Z",
  "report_date": "20260402",
  "git": {
    "repo": "murakotaro4/MS_data",
    "branch": "main",
    "head_sha": "c524f348161c8f15df6bd37bd4ae597f40142e72"
  },
  "github": {
    "run_id": "23893570079",
    "run_attempt": "1",
    "workflow": "data update",
    "event_name": "schedule"
  },
  "params": {
    "ttl": "1h",
    "rate": "2.0",
    "limit": "0"
  },
  "inputs": {
    "index": {
      "path": "cache/index.json",
      "sha256": "3ec4eff5769034e3791ad82f68792060778a2d48be9d9f49e7a1496e46359113",
      "size_bytes": 138817,
      "record_count": 564
    },
    "details_jsonl": {
      "path": "cache/details.jsonl",
      "sha256": "e83aee35ebafcf37e6f5695cb2e24bda5cb077e6b09840410e1b143b39cef96a",
      "size_bytes": 9921,
      "record_count": 9
    },
    "details_json": {
      "path": "cache/details.json",
      "sha256": "e2dbf4986375b04dfa6d17d1047c5ccca06a3de5f0e96b7c39082501a0e60c36",
      "size_bytes": 13124,
      "record_count": 9
    },
    "html_cache": {
      "path": "cache/html",
      "sha256": "680f07d5b8548bf75da9354a47a3ef967f362f3a04ccd9b29d604d2fa97df43d",
      "file_count": 14,
      "size_bytes": 2580671
    }
  },
  "outputs": {
    "msdata_json": {
      "path": "msData.json",
      "sha256": "6fb3ace2e1950e903b03a7ab65229d0d61c21ba29830b3e2564fcc9e8c7303c2",
      "size_bytes": 2493483,
      "record_count": 1617
    },
    "diff_report": {
      "path": "reports/diff_msdata_20260402.md",
      "sha256": "156aff90b4332539ef9f5d0bd4ac4101d54390c7958f210b3409590b62c01bcf",
      "size_bytes": 869
    }
  },
  "artifact": {
    "name": "raw-snapshot-20260402-run-23893570079",
    "retention_days": 90
  },
  "release": {
    "tag": "raw-snapshot-20260402-run-23893570079",
    "asset_name": "raw_snapshot_20260402_run23893570079.tar.xz",
    "url": "https://github.com/murakotaro4/MS_data/releases/tag/raw-snapshot-20260402-run-23893570079"
  }
}
